t 0 /NodeList/1/$ns3::Ipv4L3Protocol/Tx(1) ns3::Ipv4Header (tos 0x0 DSCP Default ECN Not-ECT ttl 64 id 0 protocol 105 offset (bytes) 0 flags [none] length: 56 10.0.1.1 > 10.0.2.2) ns3::TcpHeader (49153 > 50000 [SYN|ECE|CWR] Seq=0 Ack=0 Win=65535 ns3::TcpOptionTS(0;0) ns3::TcpOptionWinScale(6) ns3::TcpOptionSackPermitted([sack_perm]) ns3::TcpOptionEnd(EOL))
r 0.0450464 /NodeList/0/$ns3::Ipv4L3Protocol/Rx(1) ns3::Ipv4Header (tos 0x0 DSCP Default ECN Not-ECT ttl 64 id 0 protocol 105 offset (bytes) 0 flags [none] length: 56 10.0.1.1 > 10.0.2.2) ns3::TcpHeader (49153 > 50000 [SYN|ECE|CWR] Seq=0 Ack=0 Win=65535 ns3::TcpOptionTS(0;0) ns3::TcpOptionWinScale(6) ns3::TcpOptionSackPermitted([sack_perm]) ns3::TcpOptionEnd(EOL))
t 0.0450464 /NodeList/0/$ns3::Ipv4L3Protocol/Tx(2) ns3::Ipv4Header (tos 0x0 DSCP Default ECN Not-ECT ttl 63 id 0 protocol 105 offset (bytes) 0 flags [none] length: 56 10.0.1.1 > 10.0.2.2) ns3::TcpHeader (49153 > 50000 [SYN|ECE|CWR] Seq=0 Ack=0 Win=65535 ns3::TcpOptionTS(0;0) ns3::TcpOptionWinScale(6) ns3::TcpOptionSackPermitted([sack_perm]) ns3::TcpOptionEnd(EOL))
r 0.0452884 /NodeList/2/$ns3::Ipv4L3Protocol/Rx(1) ns3::Ipv4Header (tos 0x0 DSCP Default ECN Not-ECT ttl 63 id 0 protocol 105 offset (bytes) 0 flags [none] length: 56 10.0.1.1 > 10.0.2.2) ns3::TcpHeader (49153 > 50000 [SYN|ECE|CWR] Seq=0 Ack=0 Win=65535 ns3::TcpOptionTS(0;0) ns3::TcpOptionWinScale(6) ns3::TcpOptionSackPermitted([sack_perm]) ns3::TcpOptionEnd(EOL))
t 0.0452884 /NodeList/2/$ns3::Ipv4L3Protocol/Tx(1) ns3::Ipv4Header (tos 0x0 DSCP Default ECN Not-ECT ttl 64 id 0 protocol 105 offset (bytes) 0 flags [none] length: 56 10.0.2.2 > 10.0.1.1) ns3::TcpHeader (50000 > 49153 [SYN|ACK|ECE] Seq=0 Ack=1 Win=65535 ns3::TcpOptionTS(45;0) ns3::TcpOptionWinScale(6) ns3::TcpOptionSackPermitted([sack_perm]) ns3::TcpOptionEnd(EOL))
r 0.0455304 /NodeList/0/$ns3::Ipv4L3Protocol/Rx(2) ns3::Ipv4Header (tos 0x0 DSCP Default ECN Not-ECT ttl 64 id 0 protocol 105 offset (bytes) 0 flags [none] length: 56 10.0.2.2 > 10.0.1.1) ns3::TcpHeader (50000 > 49153 [SYN|ACK|ECE] Seq=0 Ack=1 Win=65535 ns3::TcpOptionTS(45;0) ns3::TcpOptionWinScale(6) ns3::TcpOptionSackPermitted([sack_perm]) ns3::TcpOptionEnd(EOL))
t 0.0455304 /NodeList/0/$ns3::Ipv4L3Protocol/Tx(1) ns3::Ipv4Header (tos 0x0 DSCP Default ECN Not-ECT ttl 63 id 0 protocol 105 offset (bytes) 0 flags [none] length: 56 10.0.2.2 > 10.0.1.1) ns3::TcpHeader (50000 > 49153 [SYN|ACK|ECE] Seq=0 Ack=1 Win=65535 ns3::TcpOptionTS(45;0) ns3::TcpOptionWinScale(6) ns3::TcpOptionSackPermitted([sack_perm]) ns3::TcpOptionEnd(EOL))
r 0.0905768 /NodeList/1/$ns3::Ipv4L3Protocol/Rx(1) ns3::Ipv4Header (tos 0x0 DSCP Default ECN Not-ECT ttl 63 id 0 protocol 105 offset (bytes) 0 flags [none] length: 56 10.0.2.2 > 10.0.1.1) ns3::TcpHeader (50000 > 49153 [SYN|ACK|ECE] Seq=0 Ack=1 Win=65535 ns3::TcpOptionTS(45;0) ns3::TcpOptionWinScale(6) ns3::TcpOptionSackPermitted([sack_perm]) ns3::TcpOptionEnd(EOL))
t 0.0905768 /NodeList/1/$ns3::Ipv4L3Protocol/Tx(1) ns3::Ipv4Header (tos 0x0 DSCP Default ECN Not-ECT ttl 64 id 1 protocol 105 offset (bytes) 0 flags [none] length: 52 10.0.1.1 > 10.0.2.2) ns3::TcpHeader (49153 > 50000 [ACK] Seq=1 Ack=1 Win=32768 ns3::TcpOptionTS(90;45) ns3::TcpOptionEnd(EOL))
t 0.0905768 /NodeList/1/$ns3::Ipv4L3Protocol/Tx(1) ns3::Ipv4Header (tos 0x2 DSCP Default ECN ECT (0) ttl 64 id 2 protocol 105 offset (bytes) 0 flags [none] length: 392 10.0.1.1 > 10.0.2.2) ns3::TcpHeader (49153 > 50000 [ACK] Seq=1 Ack=1 Win=32768 ns3::TcpOptionTS(90;45) ns3::TcpOptionEnd(EOL)) Payload (size=340)
t 0.0905768 /NodeList/1/$ns3::Ipv4L3Protocol/Tx(1) ns3::Ipv4Header (tos 0x2 DSCP Default ECN ECT (0) ttl 64 id 3 protocol 105 offset (bytes) 0 flags [none] length: 392 10.0.1.1 > 10.0.2.2) ns3::TcpHeader (49153 > 50000 [ACK] Seq=341 Ack=1 Win=32768 ns3::TcpOptionTS(90;45) ns3::TcpOptionEnd(EOL)) Payload (size=340)
t 0.0905768 /NodeList/1/$ns3::Ipv4L3Protocol/Tx(1) ns3::Ipv4Header (tos 0x2 DSCP Default ECN ECT (0) ttl 64 id 4 protocol 105 offset (bytes) 0 flags [none] length: 392 10.0.1.1 > 10.0.2.2) ns3::TcpHeader (49153 > 50000 [ACK] Seq=681 Ack=1 Win=32768 ns3::TcpOptionTS(90;45) ns3::TcpOptionEnd(EOL)) Payload (size=340)
t 0.0905768 /NodeList/1/$ns3::Ipv4L3Protocol/Tx(1) ns3::Ipv4Header (tos 0x2 DSCP Default ECN ECT (0) ttl 64 id 5 protocol 105 offset (bytes) 0 flags [none] length: 392 10.0.1.1 > 10.0.2.2) ns3::TcpHeader (49153 > 50000 [ACK] Seq=1021 Ack=1 Win=32768 ns3::TcpOptionTS(90;45) ns3::TcpOptionEnd(EOL)) Payload (size=340)
t 0.0905768 /NodeList/1/$ns3::Ipv4L3Protocol/Tx(1) ns3::Ipv4Header (tos 0x2 DSCP Default ECN ECT (0) ttl 64 id 6 protocol 105 offset (bytes) 0 flags [none] length: 392 10.0.1.1 > 10.0.2.2) ns3::TcpHeader (49153 > 50000 [ACK] Seq=1361 Ack=1 Win=32768 ns3::TcpOptionTS(90;45) ns3::TcpOptionEnd(EOL)) Payload (size=340)
t 0.0905768 /NodeList/1/$ns3::Ipv4L3Protocol/Tx(1) ns3::Ipv4Header (tos 0x2 DSCP Default ECN ECT (0) ttl 64 id 7 protocol 105 offset (bytes) 0 flags [none] length: 392 10.0.1.1 > 10.0.2.2) ns3::TcpHeader (49153 > 50000 [ACK] Seq=1701 Ack=1 Win=32768 ns3::TcpOptionTS(90;45) ns3::TcpOptionEnd(EOL)) Payload (size=340)
t 0.0905768 /NodeList/1/$ns3::Ipv4L3Protocol/Tx(1) ns3::Ipv4Header (tos 0x2 DSCP Default ECN ECT (0) ttl 64 id 8 protocol 105 offset (bytes) 0 flags [none] length: 392 10.0.1.1 > 10.0.2.2) ns3::TcpHeader (49153 > 50000 [ACK] Seq=2041 Ack=1 Win=32768 ns3::TcpOptionTS(90;45) ns3::TcpOptionEnd(EOL)) Payload (size=340)
t 0.0905768 /NodeList/1/$ns3::Ipv4L3Protocol/Tx(1) ns3::Ipv4Header (tos 0x2 DSCP Default ECN ECT (0) ttl 64 id 9 protocol 105 offset (bytes) 0 flags [none] length: 392 10.0.1.1 > 10.0.2.2) ns3::TcpHeader (49153 > 50000 [ACK] Seq=2381 Ack=1 Win=32768 ns3::TcpOptionTS(90;45) ns3::TcpOptionEnd(EOL)) Payload (size=340)
t 0.0905768 /NodeList/1/$ns3::Ipv4L3Protocol/Tx(1) ns3::Ipv4Header (tos 0x2 DSCP Default ECN ECT (0) ttl 64 id 10 protocol 105 offset (bytes) 0 flags [none] length: 392 10.0.1.1 > 10.0.2.2) ns3::TcpHeader (49153 > 50000 [ACK] Seq=2721 Ack=1 Win=32768 ns3::TcpOptionTS(90;45) ns3::TcpOptionEnd(EOL)) Payload (size=340)
t 0.0905768 /NodeList/1/$ns3::Ipv4L3Protocol/Tx(1) ns3::Ipv4Header (tos 0x2 DSCP Default ECN ECT (0) ttl 64 id 11 protocol 105 offset (bytes) 0 flags [none] length: 392 10.0.1.1 > 10.0.2.2) ns3::TcpHeader (49153 > 50000 [ACK] Seq=3061 Ack=1 Win=32768 ns3::TcpOptionTS(90;45) ns3::TcpOptionEnd(EOL)) Payload (size=340)
r 0.13562 /NodeList/0/$ns3::Ipv4L3Protocol/Rx(1) ns3::Ipv4Header (tos 0x0 DSCP Default ECN Not-ECT ttl 64 id 1 protocol 105 offset (bytes) 0 flags [none] length: 52 10.0.1.1 > 10.0.2.2) ns3::TcpHeader (49153 > 50000 [ACK] Seq=1 Ack=1 Win=32768 ns3::TcpOptionTS(90;45) ns3::TcpOptionEnd(EOL))
t 0.13562 /NodeList/0/$ns3::Ipv4L3Protocol/Tx(2) ns3::Ipv4Header (tos 0x0 DSCP Default ECN Not-ECT ttl 63 id 1 protocol 105 offset (bytes) 0 flags [none] length: 52 10.0.1.1 > 10.0.2.2) ns3::TcpHeader (49153 > 50000 [ACK] Seq=1 Ack=1 Win=32768 ns3::TcpOptionTS(90;45) ns3::TcpOptionEnd(EOL))
r 0.135846 /NodeList/2/$ns3::Ipv4L3Protocol/Rx(1) ns3::Ipv4Header (tos 0x0 DSCP Default ECN Not-ECT ttl 63 id 1 protocol 105 offset (bytes) 0 flags [none] length: 52 10.0.1.1 > 10.0.2.2) ns3::TcpHeader (49153 > 50000 [ACK] Seq=1 Ack=1 Win=32768 ns3::TcpOptionTS(90;45) ns3::TcpOptionEnd(EOL))
r 0.135935 /NodeList/0/$ns3::Ipv4L3Protocol/Rx(1) ns3::Ipv4Header (tos 0x2 DSCP Default ECN ECT (0) ttl 64 id 2 protocol 105 offset (bytes) 0 flags [none] length: 392 10.0.1.1 > 10.0.2.2) ns3::TcpHeader (49153 > 50000 [ACK] Seq=1 Ack=1 Win=32768 ns3::TcpOptionTS(90;45) ns3::TcpOptionEnd(EOL)) Payload (size=340)
t 0.135935 /NodeList/0/$ns3::Ipv4L3Protocol/Tx(2) ns3::Ipv4Header (tos 0x2 DSCP Default ECN ECT (0) ttl 63 id 2 protocol 105 offset (bytes) 0 flags [none] length: 392 10.0.1.1 > 10.0.2.2) ns3::TcpHeader (49153 > 50000 [ACK] Seq=1 Ack=1 Win=32768 ns3::TcpOptionTS(90;45) ns3::TcpOptionEnd(EOL)) Payload (size=340)
r 0.13625 /NodeList/0/$ns3::Ipv4L3Protocol/Rx(1) ns3::Ipv4Header (tos 0x2 DSCP Default ECN ECT (0) ttl 64 id 3 protocol 105 offset (bytes) 0 flags [none] length: 392 10.0.1.1 > 10.0.2.2) ns3::TcpHeader (49153 > 50000 [ACK] Seq=341 Ack=1 Win=32768 ns3::TcpOptionTS(90;45) ns3::TcpOptionEnd(EOL)) Payload (size=340)
t 0.13625 /NodeList/0/$ns3::Ipv4L3Protocol/Tx(2) ns3::Ipv4Header (tos 0x2 DSCP Default ECN ECT (0) ttl 63 id 3 protocol 105 offset (bytes) 0 flags [none] length: 392 10.0.1.1 > 10.0.2.2) ns3::TcpHeader (49153 > 50000 [ACK] Seq=341 Ack=1 Win=32768 ns3::TcpOptionTS(90;45) ns3::TcpOptionEnd(EOL)) Payload (size=340)
r 0.136566 /NodeList/0/$ns3::Ipv4L3Protocol/Rx(1) ns3::Ipv4Header (tos 0x2 DSCP Default ECN ECT (0) ttl 64 id 4 protocol 105 offset (bytes) 0 flags [none] length: 392 10.0.1.1 > 10.0.2.2) ns3::TcpHeader (49153 > 50000 [ACK] Seq=681 Ack=1 Win=32768 ns3::TcpOptionTS(90;45) ns3::TcpOptionEnd(EOL)) Payload (size=340)
t 0.136566 /NodeList/0/$ns3::Ipv4L3Protocol/Tx(2) ns3::Ipv4Header (tos 0x2 DSCP Default ECN ECT (0) ttl 63 id 4 protocol 105 offset (bytes) 0 flags [none] length: 392 10.0.1.1 > 10.0.2.2) ns3::TcpHeader (49153 > 50000 [ACK] Seq=681 Ack=1 Win=32768 ns3::TcpOptionTS(90;45) ns3::TcpOptionEnd(EOL)) Payload (size=340)
r 0.136881 /NodeList/0/$ns3::Ipv4L3Protocol/Rx(1) ns3::Ipv4Header (tos 0x2 DSCP Default ECN ECT (0) ttl 64 id 5 protocol 105 offset (bytes) 0 flags [none] length: 392 10.0.1.1 > 10.0.2.2) ns3::TcpHeader (49153 > 50000 [ACK] Seq=1021 Ack=1 Win=32768 ns3::TcpOptionTS(90;45) ns3::TcpOptionEnd(EOL)) Payload (size=340)
t 0.136881 /NodeList/0/$ns3::Ipv4L3Protocol/Tx(2) ns3::Ipv4Header (tos 0x2 DSCP Default ECN ECT (0) ttl 63 id 5 protocol 105 offset (bytes) 0 flags [none] length: 392 10.0.1.1 > 10.0.2.2) ns3::TcpHeader (49153 > 50000 [ACK] Seq=1021 Ack=1 Win=32768 ns3::TcpOptionTS(90;45) ns3::TcpOptionEnd(EOL)) Payload (size=340)
r 0.137196 /NodeList/0/$ns3::Ipv4L3Protocol/Rx(1) ns3::Ipv4Header (tos 0x2 DSCP Default ECN ECT (0) ttl 64 id 6 protocol 105 offset (bytes) 0 flags [none] length: 392 10.0.1.1 > 10.0.2.2) ns3::TcpHeader (49153 > 50000 [ACK] Seq=1361 Ack=1 Win=32768 ns3::TcpOptionTS(90;45) ns3::TcpOptionEnd(EOL)) Payload (size=340)
t 0.137196 /NodeList/0/$ns3::Ipv4L3Protocol/Tx(2) ns3::Ipv4Header (tos 0x2 DSCP Default ECN ECT (0) ttl 63 id 6 protocol 105 offset (bytes) 0 flags [none] length: 392 10.0.1.1 > 10.0.2.2) ns3::TcpHeader (49153 > 50000 [ACK] Seq=1361 Ack=1 Win=32768 ns3::TcpOptionTS(90;45) ns3::TcpOptionEnd(EOL)) Payload (size=340)
r 0.137511 /NodeList/0/$ns3::Ipv4L3Protocol/Rx(1) ns3::Ipv4Header (tos 0x2 DSCP Default ECN ECT (0) ttl 64 id 7 protocol 105 offset (bytes) 0 flags [none] length: 392 10.0.1.1 > 10.0.2.2) ns3::TcpHeader (49153 > 50000 [ACK] Seq=1701 Ack=1 Win=32768 ns3::TcpOptionTS(90;45) ns3::TcpOptionEnd(EOL)) Payload (size=340)
t 0.137511 /NodeList/0/$ns3::Ipv4L3Protocol/Tx(2) ns3::Ipv4Header (tos 0x2 DSCP Default ECN ECT (0) ttl 63 id 7 protocol 105 offset (bytes) 0 flags [none] length: 392 10.0.1.1 > 10.0.2.2) ns3::TcpHeader (49153 > 50000 [ACK] Seq=1701 Ack=1 Win=32768 ns3::TcpOptionTS(90;45) ns3::TcpOptionEnd(EOL)) Payload (size=340)
r 0.137521 /NodeList/2/$ns3::Ipv4L3Protocol/Rx(1) ns3::Ipv4Header (tos 0x2 DSCP Default ECN ECT (0) ttl 63 id 2 protocol 105 offset (bytes) 0 flags [none] length: 392 10.0.1.1 > 10.0.2.2) ns3::TcpHeader (49153 > 50000 [ACK] Seq=1 Ack=1 Win=32768 ns3::TcpOptionTS(90;45) ns3::TcpOptionEnd(EOL)) Payload (size=340)
t 0.137521 /NodeList/2/$ns3::Ipv4L3Protocol/Tx(1) ns3::Ipv4Header (tos 0x0 DSCP Default ECN Not-ECT ttl 64 id 1 protocol 105 offset (bytes) 0 flags [none] length: 52 10.0.2.2 > 10.0.1.1) ns3::TcpHeader (50000 > 49153 [ACK] Seq=1 Ack=341 Win=32768 ns3::TcpOptionTS(137;90) ns3::TcpOptionEnd(EOL))
r 0.137747 /NodeList/0/$ns3::Ipv4L3Protocol/Rx(2) ns3::Ipv4Header (tos 0x0 DSCP Default ECN Not-ECT ttl 64 id 1 protocol 105 offset (bytes) 0 flags [none] length: 52 10.0.2.2 > 10.0.1.1) ns3::TcpHeader (50000 > 49153 [ACK] Seq=1 Ack=341 Win=32768 ns3::TcpOptionTS(137;90) ns3::TcpOptionEnd(EOL))
t 0.137747 /NodeList/0/$ns3::Ipv4L3Protocol/Tx(1) ns3::Ipv4Header (tos 0x0 DSCP Default ECN Not-ECT ttl 63 id 1 protocol 105 offset (bytes) 0 flags [none] length: 52 10.0.2.2 > 10.0.1.1) ns3::TcpHeader (50000 > 49153 [ACK] Seq=1 Ack=341 Win=32768 ns3::TcpOptionTS(137;90) ns3::TcpOptionEnd(EOL))
r 0.137826 /NodeList/0/$ns3::Ipv4L3Protocol/Rx(1) ns3::Ipv4Header (tos 0x2 DSCP Default ECN ECT (0) ttl 64 id 8 protocol 105 offset (bytes) 0 flags [none] length: 392 10.0.1.1 > 10.0.2.2) ns3::TcpHeader (49153 > 50000 [ACK] Seq=2041 Ack=1 Win=32768 ns3::TcpOptionTS(90;45) ns3::TcpOptionEnd(EOL)) Payload (size=340)
t 0.137826 /NodeList/0/$ns3::Ipv4L3Protocol/Tx(2) ns3::Ipv4Header (tos 0x2 DSCP Default ECN ECT (0) ttl 63 id 8 protocol 105 offset (bytes) 0 flags [none] length: 392 10.0.1.1 > 10.0.2.2) ns3::TcpHeader (49153 > 50000 [ACK] Seq=2041 Ack=1 Win=32768 ns3::TcpOptionTS(90;45) ns3::TcpOptionEnd(EOL)) Payload (size=340)
r 0.138142 /NodeList/0/$ns3::Ipv4L3Protocol/Rx(1) ns3::Ipv4Header (tos 0x2 DSCP Default ECN ECT (0) ttl 64 id 9 protocol 105 offset (bytes) 0 flags [none] length: 392 10.0.1.1 > 10.0.2.2) ns3::TcpHeader (49153 > 50000 [ACK] Seq=2381 Ack=1 Win=32768 ns3::TcpOptionTS(90;45) ns3::TcpOptionEnd(EOL)) Payload (size=340)
t 0.138142 /NodeList/0/$ns3::Ipv4L3Protocol/Tx(2) ns3::Ipv4Header (tos 0x2 DSCP Default ECN ECT (0) ttl 63 id 9 protocol 105 offset (bytes) 0 flags [none] length: 392 10.0.1.1 > 10.0.2.2) ns3::TcpHeader (49153 > 50000 [ACK] Seq=2381 Ack=1 Win=32768 ns3::TcpOptionTS(90;45) ns3::TcpOptionEnd(EOL)) Payload (size=340)
r 0.138457 /NodeList/0/$ns3::Ipv4L3Protocol/Rx(1) ns3::Ipv4Header (tos 0x2 DSCP Default ECN ECT (0) ttl 64 id 10 protocol 105 offset (bytes) 0 flags [none] length: 392 10.0.1.1 > 10.0.2.2) ns3::TcpHeader (49153 > 50000 [ACK] Seq=2721 Ack=1 Win=32768 ns3::TcpOptionTS(90;45) ns3::TcpOptionEnd(EOL)) Payload (size=340)
t 0.138457 /NodeList/0/$ns3::Ipv4L3Protocol/Tx(2) ns3::Ipv4Header (tos 0x2 DSCP Default ECN ECT (0) ttl 63 id 10 protocol 105 offset (bytes) 0 flags [none] length: 392 10.0.1.1 > 10.0.2.2) ns3::TcpHeader (49153 > 50000 [ACK] Seq=2721 Ack=1 Win=32768 ns3::TcpOptionTS(90;45) ns3::TcpOptionEnd(EOL)) Payload (size=340)
r 0.138772 /NodeList/0/$ns3::Ipv4L3Protocol/Rx(1) ns3::Ipv4Header (tos 0x2 DSCP Default ECN ECT (0) ttl 64 id 11 protocol 105 offset (bytes) 0 flags [none] length: 392 10.0.1.1 > 10.0.2.2) ns3::TcpHeader (49153 > 50000 [ACK] Seq=3061 Ack=1 Win=32768 ns3::TcpOptionTS(90;45) ns3::TcpOptionEnd(EOL)) Payload (size=340)
t 0.138772 /NodeList/0/$ns3::Ipv4L3Protocol/Tx(2) ns3::Ipv4Header (tos 0x2 DSCP Default ECN ECT (0) ttl 63 id 11 protocol 105 offset (bytes) 0 flags [none] length: 392 10.0.1.1 > 10.0.2.2) ns3::TcpHeader (49153 > 50000 [ACK] Seq=3061 Ack=1 Win=32768 ns3::TcpOptionTS(90;45) ns3::TcpOptionEnd(EOL)) Payload (size=340)
r 0.139097 /NodeList/2/$ns3::Ipv4L3Protocol/Rx(1) ns3::Ipv4Header (tos 0x2 DSCP Default ECN ECT (0) ttl 63 id 3 protocol 105 offset (bytes) 0 flags [none] length: 392 10.0.1.1 > 10.0.2.2) ns3::TcpHeader (49153 > 50000 [ACK] Seq=341 Ack=1 Win=32768 ns3::TcpOptionTS(90;45) ns3::TcpOptionEnd(EOL)) Payload (size=340)
r 0.140673 /NodeList/2/$ns3::Ipv4L3Protocol/Rx(1) ns3::Ipv4Header (tos 0x2 DSCP Default ECN ECT (0) ttl 63 id 4 protocol 105 offset (bytes) 0 flags [none] length: 392 10.0.1.1 > 10.0.2.2) ns3::TcpHeader (49153 > 50000 [ACK] Seq=681 Ack=1 Win=32768 ns3::TcpOptionTS(90;45) ns3::TcpOptionEnd(EOL)) Payload (size=340)
t 0.140673 /NodeList/2/$ns3::Ipv4L3Protocol/Tx(1) ns3::Ipv4Header (tos 0x0 DSCP Default ECN Not-ECT ttl 64 id 2 protocol 105 offset (bytes) 0 flags [none] length: 52 10.0.2.2 > 10.0.1.1) ns3::TcpHeader (50000 > 49153 [ACK] Seq=1 Ack=1021 Win=32768 ns3::TcpOptionTS(140;90) ns3::TcpOptionEnd(EOL))
r 0.140899 /NodeList/0/$ns3::Ipv4L3Protocol/Rx(2) ns3::Ipv4Header (tos 0x0 DSCP Default ECN Not-ECT ttl 64 id 2 protocol 105 offset (bytes) 0 flags [none] length: 52 10.0.2.2 > 10.0.1.1) ns3::TcpHeader (50000 > 49153 [ACK] Seq=1 Ack=1021 Win=32768 ns3::TcpOptionTS(140;90) ns3::TcpOptionEnd(EOL))
t 0.140899 /NodeList/0/$ns3::Ipv4L3Protocol/Tx(1) ns3::Ipv4Header (tos 0x0 DSCP Default ECN Not-ECT ttl 63 id 2 protocol 105 offset (bytes) 0 flags [none] length: 52 10.0.2.2 > 10.0.1.1) ns3::TcpHeader (50000 > 49153 [ACK] Seq=1 Ack=1021 Win=32768 ns3::TcpOptionTS(140;90) ns3::TcpOptionEnd(EOL))
r 0.142249 /NodeList/2/$ns3::Ipv4L3Protocol/Rx(1) ns3::Ipv4Header (tos 0x2 DSCP Default ECN ECT (0) ttl 63 id 5 protocol 105 offset (bytes) 0 flags [none] length: 392 10.0.1.1 > 10.0.2.2) ns3::TcpHeader (49153 > 50000 [ACK] Seq=1021 Ack=1 Win=32768 ns3::TcpOptionTS(90;45) ns3::TcpOptionEnd(EOL)) Payload (size=340)
r 0.143825 /NodeList/2/$ns3::Ipv4L3Protocol/Rx(1) ns3::Ipv4Header (tos 0x2 DSCP Default ECN ECT (0) ttl 63 id 6 protocol 105 offset (bytes) 0 flags [none] length: 392 10.0.1.1 > 10.0.2.2) ns3::TcpHeader (49153 > 50000 [ACK] Seq=1361 Ack=1 Win=32768 ns3::TcpOptionTS(90;45) ns3::TcpOptionEnd(EOL)) Payload (size=340)
t 0.143825 /NodeList/2/$ns3::Ipv4L3Protocol/Tx(1) ns3::Ipv4Header (tos 0x0 DSCP Default ECN Not-ECT ttl 64 id 3 protocol 105 offset (bytes) 0 flags [none] length: 52 10.0.2.2 > 10.0.1.1) ns3::TcpHeader (50000 > 49153 [ACK] Seq=1 Ack=1701 Win=32768 ns3::TcpOptionTS(143;90) ns3::TcpOptionEnd(EOL))
r 0.144051 /NodeList/0/$ns3::Ipv4L3Protocol/Rx(2) ns3::Ipv4Header (tos 0x0 DSCP Default ECN Not-ECT ttl 64 id 3 protocol 105 offset (bytes) 0 flags [none] length: 52 10.0.2.2 > 10.0.1.1) ns3::TcpHeader (50000 > 49153 [ACK] Seq=1 Ack=1701 Win=32768 ns3::TcpOptionTS(143;90) ns3::TcpOptionEnd(EOL))
t 0.144051 /NodeList/0/$ns3::Ipv4L3Protocol/Tx(1) ns3::Ipv4Header (tos 0x0 DSCP Default ECN Not-ECT ttl 63 id 3 protocol 105 offset (bytes) 0 flags [none] length: 52 10.0.2.2 > 10.0.1.1) ns3::TcpHeader (50000 > 49153 [ACK] Seq=1 Ack=1701 Win=32768 ns3::TcpOptionTS(143;90) ns3::TcpOptionEnd(EOL))
r 0.145401 /NodeList/2/$ns3::Ipv4L3Protocol/Rx(1) ns3::Ipv4Header (tos 0x2 DSCP Default ECN ECT (0) ttl 63 id 7 protocol 105 offset (bytes) 0 flags [none] length: 392 10.0.1.1 > 10.0.2.2) ns3::TcpHeader (49153 > 50000 [ACK] Seq=1701 Ack=1 Win=32768 ns3::TcpOptionTS(90;45) ns3::TcpOptionEnd(EOL)) Payload (size=340)
r 0.146977 /NodeList/2/$ns3::Ipv4L3Protocol/Rx(1) ns3::Ipv4Header (tos 0x2 DSCP Default ECN ECT (0) ttl 63 id 8 protocol 105 offset (bytes) 0 flags [none] length: 392 10.0.1.1 > 10.0.2.2) ns3::TcpHeader (49153 > 50000 [ACK] Seq=2041 Ack=1 Win=32768 ns3::TcpOptionTS(90;45) ns3::TcpOptionEnd(EOL)) Payload (size=340)
t 0.146977 /NodeList/2/$ns3::Ipv4L3Protocol/Tx(1) ns3::Ipv4Header (tos 0x0 DSCP Default ECN Not-ECT ttl 64 id 4 protocol 105 offset (bytes) 0 flags [none] length: 52 10.0.2.2 > 10.0.1.1) ns3::TcpHeader (50000 > 49153 [ACK] Seq=1 Ack=2381 Win=32768 ns3::TcpOptionTS(146;90) ns3::TcpOptionEnd(EOL))
r 0.147203 /NodeList/0/$ns3::Ipv4L3Protocol/Rx(2) ns3::Ipv4Header (tos 0x0 DSCP Default ECN Not-ECT ttl 64 id 4 protocol 105 offset (bytes) 0 flags [none] length: 52 10.0.2.2 > 10.0.1.1) ns3::TcpHeader (50000 > 49153 [ACK] Seq=1 Ack=2381 Win=32768 ns3::TcpOptionTS(146;90) ns3::TcpOptionEnd(EOL))
t 0.147203 /NodeList/0/$ns3::Ipv4L3Protocol/Tx(1) ns3::Ipv4Header (tos 0x0 DSCP Default ECN Not-ECT ttl 63 id 4 protocol 105 offset (bytes) 0 flags [none] length: 52 10.0.2.2 > 10.0.1.1) ns3::TcpHeader (50000 > 49153 [ACK] Seq=1 Ack=2381 Win=32768 ns3::TcpOptionTS(146;90) ns3::TcpOptionEnd(EOL))
r 0.150129 /NodeList/2/$ns3::Ipv4L3Protocol/Rx(1) ns3::Ipv4Header (tos 0x2 DSCP Default ECN ECT (0) ttl 63 id 10 protocol 105 offset (bytes) 0 flags [none] length: 392 10.0.1.1 > 10.0.2.2) ns3::TcpHeader (49153 > 50000 [ACK] Seq=2721 Ack=1 Win=32768 ns3::TcpOptionTS(90;45) ns3::TcpOptionEnd(EOL)) Payload (size=340)
t 0.150129 /NodeList/2/$ns3::Ipv4L3Protocol/Tx(1) ns3::Ipv4Header (tos 0x0 DSCP Default ECN Not-ECT ttl 64 id 5 protocol 105 offset (bytes) 0 flags [none] length: 60 10.0.2.2 > 10.0.1.1) ns3::TcpHeader (50000 > 49153 [ACK] Seq=1 Ack=2381 Win=32768 ns3::TcpOptionTS(150;90) ns3::TcpOptionSack(blocks: 1,[2721,3061]))
r 0.150387 /NodeList/0/$ns3::Ipv4L3Protocol/Rx(2) ns3::Ipv4Header (tos 0x0 DSCP Default ECN Not-ECT ttl 64 id 5 protocol 105 offset (bytes) 0 flags [none] length: 60 10.0.2.2 > 10.0.1.1) ns3::TcpHeader (50000 > 49153 [ACK] Seq=1 Ack=2381 Win=32768 ns3::TcpOptionTS(150;90) ns3::TcpOptionSack(blocks: 1,[2721,3061]))
t 0.150387 /NodeList/0/$ns3::Ipv4L3Protocol/Tx(1) ns3::Ipv4Header (tos 0x0 DSCP Default ECN Not-ECT ttl 63 id 5 protocol 105 offset (bytes) 0 flags [none] length: 60 10.0.2.2 > 10.0.1.1) ns3::TcpHeader (50000 > 49153 [ACK] Seq=1 Ack=2381 Win=32768 ns3::TcpOptionTS(150;90) ns3::TcpOptionSack(blocks: 1,[2721,3061]))
r 0.151705 /NodeList/2/$ns3::Ipv4L3Protocol/Rx(1) ns3::Ipv4Header (tos 0x2 DSCP Default ECN ECT (0) ttl 63 id 11 protocol 105 offset (bytes) 0 flags [none] length: 392 10.0.1.1 > 10.0.2.2) ns3::TcpHeader (49153 > 50000 [ACK] Seq=3061 Ack=1 Win=32768 ns3::TcpOptionTS(90;45) ns3::TcpOptionEnd(EOL)) Payload (size=340)
t 0.151705 /NodeList/2/$ns3::Ipv4L3Protocol/Tx(1) ns3::Ipv4Header (tos 0x0 DSCP Default ECN Not-ECT ttl 64 id 6 protocol 105 offset (bytes) 0 flags [none] length: 60 10.0.2.2 > 10.0.1.1) ns3::TcpHeader (50000 > 49153 [ACK] Seq=1 Ack=2381 Win=32768 ns3::TcpOptionTS(151;90) ns3::TcpOptionSack(blocks: 1,[2721,3401]))
r 0.18279 /NodeList/1/$ns3::Ipv4L3Protocol/Rx(1) ns3::Ipv4Header (tos 0x0 DSCP Default ECN Not-ECT ttl 63 id 1 protocol 105 offset (bytes) 0 flags [none] length: 52 10.0.2.2 > 10.0.1.1) ns3::TcpHeader (50000 > 49153 [ACK] Seq=1 Ack=341 Win=32768 ns3::TcpOptionTS(137;90) ns3::TcpOptionEnd(EOL))
t 0.18279 /NodeList/1/$ns3::Ipv4L3Protocol/Tx(1) ns3::Ipv4Header (tos 0x2 DSCP Default ECN ECT (0) ttl 64 id 12 protocol 105 offset (bytes) 0 flags [none] length: 392 10.0.1.1 > 10.0.2.2) ns3::TcpHeader (49153 > 50000 [ACK] Seq=3401 Ack=1 Win=32768 ns3::TcpOptionTS(182;137) ns3::TcpOptionEnd(EOL)) Payload (size=340)
t 0.18279 /NodeList/1/$ns3::Ipv4L3Protocol/Tx(1) ns3::Ipv4Header (tos 0x2 DSCP Default ECN ECT (0) ttl 64 id 13 protocol 105 offset (bytes) 0 flags [none] length: 392 10.0.1.1 > 10.0.2.2) ns3::TcpHeader (49153 > 50000 [ACK] Seq=3741 Ack=1 Win=32768 ns3::TcpOptionTS(182;137) ns3::TcpOptionEnd(EOL)) Payload (size=340)
r 0.185942 /NodeList/1/$ns3::Ipv4L3Protocol/Rx(1) ns3::Ipv4Header (tos 0x0 DSCP Default ECN Not-ECT ttl 63 id 2 protocol 105 offset (bytes) 0 flags [none] length: 52 10.0.2.2 > 10.0.1.1) ns3::TcpHeader (50000 > 49153 [ACK] Seq=1 Ack=1021 Win=32768 ns3::TcpOptionTS(140;90) ns3::TcpOptionEnd(EOL))
t 0.185942 /NodeList/1/$ns3::Ipv4L3Protocol/Tx(1) ns3::Ipv4Header (tos 0x2 DSCP Default ECN ECT (0) ttl 64 id 14 protocol 105 offset (bytes) 0 flags [none] length: 392 10.0.1.1 > 10.0.2.2) ns3::TcpHeader (49153 > 50000 [ACK] Seq=4081 Ack=1 Win=32768 ns3::TcpOptionTS(185;140) ns3::TcpOptionEnd(EOL)) Payload (size=340)
t 0.185942 /NodeList/1/$ns3::Ipv4L3Protocol/Tx(1) ns3::Ipv4Header (tos 0x2 DSCP Default ECN ECT (0) ttl 64 id 15 protocol 105 offset (bytes) 0 flags [none] length: 392 10.0.1.1 > 10.0.2.2) ns3::TcpHeader (49153 > 50000 [ACK] Seq=4421 Ack=1 Win=32768 ns3::TcpOptionTS(185;140) ns3::TcpOptionEnd(EOL)) Payload (size=340)
t 0.185942 /NodeList/1/$ns3::Ipv4L3Protocol/Tx(1) ns3::Ipv4Header (tos 0x2 DSCP Default ECN ECT (0) ttl 64 id 16 protocol 105 offset (bytes) 0 flags [none] length: 392 10.0.1.1 > 10.0.2.2) ns3::TcpHeader (49153 > 50000 [ACK] Seq=4761 Ack=1 Win=32768 ns3::TcpOptionTS(185;140) ns3::TcpOptionEnd(EOL)) Payload (size=340)
r 0.189094 /NodeList/1/$ns3::Ipv4L3Protocol/Rx(1) ns3::Ipv4Header (tos 0x0 DSCP Default ECN Not-ECT ttl 63 id 3 protocol 105 offset (bytes) 0 flags [none] length: 52 10.0.2.2 > 10.0.1.1) ns3::TcpHeader (50000 > 49153 [ACK] Seq=1 Ack=1701 Win=32768 ns3::TcpOptionTS(143;90) ns3::TcpOptionEnd(EOL))
t 0.189094 /NodeList/1/$ns3::Ipv4L3Protocol/Tx(1) ns3::Ipv4Header (tos 0x2 DSCP Default ECN ECT (0) ttl 64 id 17 protocol 105 offset (bytes) 0 flags [none] length: 392 10.0.1.1 > 10.0.2.2) ns3::TcpHeader (49153 > 50000 [ACK] Seq=5101 Ack=1 Win=32768 ns3::TcpOptionTS(189;143) ns3::TcpOptionEnd(EOL)) Payload (size=340)
t 0.189094 /NodeList/1/$ns3::Ipv4L3Protocol/Tx(1) ns3::Ipv4Header (tos 0x2 DSCP Default ECN ECT (0) ttl 64 id 18 protocol 105 offset (bytes) 0 flags [none] length: 392 10.0.1.1 > 10.0.2.2) ns3::TcpHeader (49153 > 50000 [ACK] Seq=5441 Ack=1 Win=32768 ns3::TcpOptionTS(189;143) ns3::TcpOptionEnd(EOL)) Payload (size=340)
t 0.189094 /NodeList/1/$ns3::Ipv4L3Protocol/Tx(1) ns3::Ipv4Header (tos 0x2 DSCP Default ECN ECT (0) ttl 64 id 19 protocol 105 offset (bytes) 0 flags [none] length: 392 10.0.1.1 > 10.0.2.2) ns3::TcpHeader (49153 > 50000 [ACK] Seq=5781 Ack=1 Win=32768 ns3::TcpOptionTS(189;143) ns3::TcpOptionEnd(EOL)) Payload (size=340)
r 0.192246 /NodeList/1/$ns3::Ipv4L3Protocol/Rx(1) ns3::Ipv4Header (tos 0x0 DSCP Default ECN Not-ECT ttl 63 id 4 protocol 105 offset (bytes) 0 flags [none] length: 52 10.0.2.2 > 10.0.1.1) ns3::TcpHeader (50000 > 49153 [ACK] Seq=1 Ack=2381 Win=32768 ns3::TcpOptionTS(146;90) ns3::TcpOptionEnd(EOL))
t 0.192246 /NodeList/1/$ns3::Ipv4L3Protocol/Tx(1) ns3::Ipv4Header (tos 0x2 DSCP Default ECN ECT (0) ttl 64 id 20 protocol 105 offset (bytes) 0 flags [none] length: 392 10.0.1.1 > 10.0.2.2) ns3::TcpHeader (49153 > 50000 [ACK] Seq=6121 Ack=1 Win=32768 ns3::TcpOptionTS(192;146) ns3::TcpOptionEnd(EOL)) Payload (size=340)
t 0.192246 /NodeList/1/$ns3::Ipv4L3Protocol/Tx(1) ns3::Ipv4Header (tos 0x2 DSCP Default ECN ECT (0) ttl 64 id 21 protocol 105 offset (bytes) 0 flags [none] length: 392 10.0.1.1 > 10.0.2.2) ns3::TcpHeader (49153 > 50000 [ACK] Seq=6461 Ack=1 Win=32768 ns3::TcpOptionTS(192;146) ns3::TcpOptionEnd(EOL)) Payload (size=340)
t 0.192246 /NodeList/1/$ns3::Ipv4L3Protocol/Tx(1) ns3::Ipv4Header (tos 0x2 DSCP Default ECN ECT (0) ttl 64 id 22 protocol 105 offset (bytes) 0 flags [none] length: 392 10.0.1.1 > 10.0.2.2) ns3::TcpHeader (49153 > 50000 [ACK] Seq=6801 Ack=1 Win=32768 ns3::TcpOptionTS(192;146) ns3::TcpOptionEnd(EOL)) Payload (size=340)
r 0.195437 /NodeList/1/$ns3::Ipv4L3Protocol/Rx(1) ns3::Ipv4Header (tos 0x0 DSCP Default ECN Not-ECT ttl 63 id 5 protocol 105 offset (bytes) 0 flags [none] length: 60 10.0.2.2 > 10.0.1.1) ns3::TcpHeader (50000 > 49153 [ACK] Seq=1 Ack=2381 Win=32768 ns3::TcpOptionTS(150;90) ns3::TcpOptionSack(blocks: 1,[2721,3061]))
t 0.195437 /NodeList/1/$ns3::Ipv4L3Protocol/Tx(1) ns3::Ipv4Header (tos 0x2 DSCP Default ECN ECT (0) ttl 64 id 23 protocol 105 offset (bytes) 0 flags [none] length: 392 10.0.1.1 > 10.0.2.2) ns3::TcpHeader (49153 > 50000 [ACK] Seq=7141 Ack=1 Win=32768 ns3::TcpOptionTS(195;150) ns3::TcpOptionEnd(EOL)) Payload (size=340)
r 0.228106 /NodeList/0/$ns3::Ipv4L3Protocol/Rx(1) ns3::Ipv4Header (tos 0x2 DSCP Default ECN ECT (0) ttl 64 id 12 protocol 105 offset (bytes) 0 flags [none] length: 392 10.0.1.1 > 10.0.2.2) ns3::TcpHeader (49153 > 50000 [ACK] Seq=3401 Ack=1 Win=32768 ns3::TcpOptionTS(182;137) ns3::TcpOptionEnd(EOL)) Payload (size=340)
t 0.228106 /NodeList/0/$ns3::Ipv4L3Protocol/Tx(2) ns3::Ipv4Header (tos 0x2 DSCP Default ECN ECT (0) ttl 63 id 12 protocol 105 offset (bytes) 0 flags [none] length: 392 10.0.1.1 > 10.0.2.2) ns3::TcpHeader (49153 > 50000 [ACK] Seq=3401 Ack=1 Win=32768 ns3::TcpOptionTS(182;137) ns3::TcpOptionEnd(EOL)) Payload (size=340)
r 0.228421 /NodeList/0/$ns3::Ipv4L3Protocol/Rx(1) ns3::Ipv4Header (tos 0x2 DSCP Default ECN ECT (0) ttl 64 id 13 protocol 105 offset (bytes) 0 flags [none] length: 392 10.0.1.1 > 10.0.2.2) ns3::TcpHeader (49153 > 50000 [ACK] Seq=3741 Ack=1 Win=32768 ns3::TcpOptionTS(182;137) ns3::TcpOptionEnd(EOL)) Payload (size=340)
t 0.228421 /NodeList/0/$ns3::Ipv4L3Protocol/Tx(2) ns3::Ipv4Header (tos 0x2 DSCP Default ECN ECT (0) ttl 63 id 13 protocol 105 offset (bytes) 0 flags [none] length: 392 10.0.1.1 > 10.0.2.2) ns3::TcpHeader (49153 > 50000 [ACK] Seq=3741 Ack=1 Win=32768 ns3::TcpOptionTS(182;137) ns3::TcpOptionEnd(EOL)) Payload (size=340)
r 0.229692 /NodeList/2/$ns3::Ipv4L3Protocol/Rx(1) ns3::Ipv4Header (tos 0x2 DSCP Default ECN ECT (0) ttl 63 id 12 protocol 105 offset (bytes) 0 flags [none] length: 392 10.0.1.1 > 10.0.2.2) ns3::TcpHeader (49153 > 50000 [ACK] Seq=3401 Ack=1 Win=32768 ns3::TcpOptionTS(182;137) ns3::TcpOptionEnd(EOL)) Payload (size=340)
t 0.229692 /NodeList/2/$ns3::Ipv4L3Protocol/Tx(1) ns3::Ipv4Header (tos 0x0 DSCP Default ECN Not-ECT ttl 64 id 7 protocol 105 offset (bytes) 0 flags [none] length: 60 10.0.2.2 > 10.0.1.1) ns3::TcpHeader (50000 > 49153 [ACK] Seq=1 Ack=2381 Win=32768 ns3::TcpOptionTS(229;90) ns3::TcpOptionSack(blocks: 1,[2721,3741]))
r 0.22995 /NodeList/0/$ns3::Ipv4L3Protocol/Rx(2) ns3::Ipv4Header (tos 0x0 DSCP Default ECN Not-ECT ttl 64 id 7 protocol 105 offset (bytes) 0 flags [none] length: 60 10.0.2.2 > 10.0.1.1) ns3::TcpHeader (50000 > 49153 [ACK] Seq=1 Ack=2381 Win=32768 ns3::TcpOptionTS(229;90) ns3::TcpOptionSack(blocks: 1,[2721,3741]))
t 0.22995 /NodeList/0/$ns3::Ipv4L3Protocol/Tx(1) ns3::Ipv4Header (tos 0x0 DSCP Default ECN Not-ECT ttl 63 id 7 protocol 105 offset (bytes) 0 flags [none] length: 60 10.0.2.2 > 10.0.1.1) ns3::TcpHeader (50000 > 49153 [ACK] Seq=1 Ack=2381 Win=32768 ns3::TcpOptionTS(229;90) ns3::TcpOptionSack(blocks: 1,[2721,3741]))
r 0.231258 /NodeList/0/$ns3::Ipv4L3Protocol/Rx(1) ns3::Ipv4Header (tos 0x2 DSCP Default ECN ECT (0) ttl 64 id 14 protocol 105 offset (bytes) 0 flags [none] length: 392 10.0.1.1 > 10.0.2.2) ns3::TcpHeader (49153 > 50000 [ACK] Seq=4081 Ack=1 Win=32768 ns3::TcpOptionTS(185;140) ns3::TcpOptionEnd(EOL)) Payload (size=340)
t 0.231258 /NodeList/0/$ns3::Ipv4L3Protocol/Tx(2) ns3::Ipv4Header (tos 0x2 DSCP Default ECN ECT (0) ttl 63 id 14 protocol 105 offset (bytes) 0 flags [none] length: 392 10.0.1.1 > 10.0.2.2) ns3::TcpHeader (49153 > 50000 [ACK] Seq=4081 Ack=1 Win=32768 ns3::TcpOptionTS(185;140) ns3::TcpOptionEnd(EOL)) Payload (size=340)
r 0.231268 /NodeList/2/$ns3::Ipv4L3Protocol/Rx(1) ns3::Ipv4Header (tos 0x2 DSCP Default ECN ECT (0) ttl 63 id 13 protocol 105 offset (bytes) 0 flags [none] length: 392 10.0.1.1 > 10.0.2.2) ns3::TcpHeader (49153 > 50000 [ACK] Seq=3741 Ack=1 Win=32768 ns3::TcpOptionTS(182;137) ns3::TcpOptionEnd(EOL)) Payload (size=340)
t 0.231268 /NodeList/2/$ns3::Ipv4L3Protocol/Tx(1) ns3::Ipv4Header (tos 0x0 DSCP Default ECN Not-ECT ttl 64 id 8 protocol 105 offset (bytes) 0 flags [none] length: 60 10.0.2.2 > 10.0.1.1) ns3::TcpHeader (50000 > 49153 [ACK] Seq=1 Ack=2381 Win=32768 ns3::TcpOptionTS(231;90) ns3::TcpOptionSack(blocks: 1,[2721,4081]))
r 0.231526 /NodeList/0/$ns3::Ipv4L3Protocol/Rx(2) ns3::Ipv4Header (tos 0x0 DSCP Default ECN Not-ECT ttl 64 id 8 protocol 105 offset (bytes) 0 flags [none] length: 60 10.0.2.2 > 10.0.1.1) ns3::TcpHeader (50000 > 49153 [ACK] Seq=1 Ack=2381 Win=32768 ns3::TcpOptionTS(231;90) ns3::TcpOptionSack(blocks: 1,[2721,4081]))
t 0.231526 /NodeList/0/$ns3::Ipv4L3Protocol/Tx(1) ns3::Ipv4Header (tos 0x0 DSCP Default ECN Not-ECT ttl 63 id 8 protocol 105 offset (bytes) 0 flags [none] length: 60 10.0.2.2 > 10.0.1.1) ns3::TcpHeader (50000 > 49153 [ACK] Seq=1 Ack=2381 Win=32768 ns3::TcpOptionTS(231;90) ns3::TcpOptionSack(blocks: 1,[2721,4081]))
r 0.231573 /NodeList/0/$ns3::Ipv4L3Protocol/Rx(1) ns3::Ipv4Header (tos 0x2 DSCP Default ECN ECT (0) ttl 64 id 15 protocol 105 offset (bytes) 0 flags [none] length: 392 10.0.1.1 > 10.0.2.2) ns3::TcpHeader (49153 > 50000 [ACK] Seq=4421 Ack=1 Win=32768 ns3::TcpOptionTS(185;140) ns3::TcpOptionEnd(EOL)) Payload (size=340)
t 0.231573 /NodeList/0/$ns3::Ipv4L3Protocol/Tx(2) ns3::Ipv4Header (tos 0x2 DSCP Default ECN ECT (0) ttl 63 id 15 protocol 105 offset (bytes) 0 flags [none] length: 392 10.0.1.1 > 10.0.2.2) ns3::TcpHeader (49153 > 50000 [ACK] Seq=4421 Ack=1 Win=32768 ns3::TcpOptionTS(185;140) ns3::TcpOptionEnd(EOL)) Payload (size=340)
r 0.231888 /NodeList/0/$ns3::Ipv4L3Protocol/Rx(1) ns3::Ipv4Header (tos 0x2 DSCP Default ECN ECT (0) ttl 64 id 16 protocol 105 offset (bytes) 0 flags [none] length: 392 10.0.1.1 > 10.0.2.2) ns3::TcpHeader (49153 > 50000 [ACK] Seq=4761 Ack=1 Win=32768 ns3::TcpOptionTS(185;140) ns3::TcpOptionEnd(EOL)) Payload (size=340)
t 0.231888 /NodeList/0/$ns3::Ipv4L3Protocol/Tx(2) ns3::Ipv4Header (tos 0x2 DSCP Default ECN ECT (0) ttl 63 id 16 protocol 105 offset (bytes) 0 flags [none] length: 392 10.0.1.1 > 10.0.2.2) ns3::TcpHeader (49153 > 50000 [ACK] Seq=4761 Ack=1 Win=32768 ns3::TcpOptionTS(185;140) ns3::TcpOptionEnd(EOL)) Payload (size=340)
r 0.232844 /NodeList/2/$ns3::Ipv4L3Protocol/Rx(1) ns3::Ipv4Header (tos 0x2 DSCP Default ECN ECT (0) ttl 63 id 14 protocol 105 offset (bytes) 0 flags [none] length: 392 10.0.1.1 > 10.0.2.2) ns3::TcpHeader (49153 > 50000 [ACK] Seq=4081 Ack=1 Win=32768 ns3::TcpOptionTS(185;140) ns3::TcpOptionEnd(EOL)) Payload (size=340)
t 0.232844 /NodeList/2/$ns3::Ipv4L3Protocol/Tx(1) ns3::Ipv4Header (tos 0x0 DSCP Default ECN Not-ECT ttl 64 id 9 protocol 105 offset (bytes) 0 flags [none] length: 60 10.0.2.2 > 10.0.1.1) ns3::TcpHeader (50000 > 49153 [ACK] Seq=1 Ack=2381 Win=32768 ns3::TcpOptionTS(232;90) ns3::TcpOptionSack(blocks: 1,[2721,4421]))
r 0.233102 /NodeList/0/$ns3::Ipv4L3Protocol/Rx(2) ns3::Ipv4Header (tos 0x0 DSCP Default ECN Not-ECT ttl 64 id 9 protocol 105 offset (bytes) 0 flags [none] length: 60 10.0.2.2 > 10.0.1.1) ns3::TcpHeader (50000 > 49153 [ACK] Seq=1 Ack=2381 Win=32768 ns3::TcpOptionTS(232;90) ns3::TcpOptionSack(blocks: 1,[2721,4421]))
t 0.233102 /NodeList/0/$ns3::Ipv4L3Protocol/Tx(1) ns3::Ipv4Header (tos 0x0 DSCP Default ECN Not-ECT ttl 63 id 9 protocol 105 offset (bytes) 0 flags [none] length: 60 10.0.2.2 > 10.0.1.1) ns3::TcpHeader (50000 > 49153 [ACK] Seq=1 Ack=2381 Win=32768 ns3::TcpOptionTS(232;90) ns3::TcpOptionSack(blocks: 1,[2721,4421]))
r 0.23441 /NodeList/0/$ns3::Ipv4L3Protocol/Rx(1) ns3::Ipv4Header (tos 0x2 DSCP Default ECN ECT (0) ttl 64 id 17 protocol 105 offset (bytes) 0 flags [none] length: 392 10.0.1.1 > 10.0.2.2) ns3::TcpHeader (49153 > 50000 [ACK] Seq=5101 Ack=1 Win=32768 ns3::TcpOptionTS(189;143) ns3::TcpOptionEnd(EOL)) Payload (size=340)
t 0.23441 /NodeList/0/$ns3::Ipv4L3Protocol/Tx(2) ns3::Ipv4Header (tos 0x2 DSCP Default ECN ECT (0) ttl 63 id 17 protocol 105 offset (bytes) 0 flags [none] length: 392 10.0.1.1 > 10.0.2.2) ns3::TcpHeader (49153 > 50000 [ACK] Seq=5101 Ack=1 Win=32768 ns3::TcpOptionTS(189;143) ns3::TcpOptionEnd(EOL)) Payload (size=340)
r 0.23442 /NodeList/2/$ns3::Ipv4L3Protocol/Rx(1) ns3::Ipv4Header (tos 0x2 DSCP Default ECN ECT (0) ttl 63 id 15 protocol 105 offset (bytes) 0 flags [none] length: 392 10.0.1.1 > 10.0.2.2) ns3::TcpHeader (49153 > 50000 [ACK] Seq=4421 Ack=1 Win=32768 ns3::TcpOptionTS(185;140) ns3::TcpOptionEnd(EOL)) Payload (size=340)
t 0.23442 /NodeList/2/$ns3::Ipv4L3Protocol/Tx(1) ns3::Ipv4Header (tos 0x0 DSCP Default ECN Not-ECT ttl 64 id 10 protocol 105 offset (bytes) 0 flags [none] length: 60 10.0.2.2 > 10.0.1.1) ns3::TcpHeader (50000 > 49153 [ACK] Seq=1 Ack=2381 Win=32768 ns3::TcpOptionTS(234;90) ns3::TcpOptionSack(blocks: 1,[2721,4761]))
r 0.234678 /NodeList/0/$ns3::Ipv4L3Protocol/Rx(2) ns3::Ipv4Header (tos 0x0 DSCP Default ECN Not-ECT ttl 64 id 10 protocol 105 offset (bytes) 0 flags [none] length: 60 10.0.2.2 > 10.0.1.1) ns3::TcpHeader (50000 > 49153 [ACK] Seq=1 Ack=2381 Win=32768 ns3::TcpOptionTS(234;90) ns3::TcpOptionSack(blocks: 1,[2721,4761]))
t 0.234678 /NodeList/0/$ns3::Ipv4L3Protocol/Tx(1) ns3::Ipv4Header (tos 0x0 DSCP Default ECN Not-ECT ttl 63 id 10 protocol 105 offset (bytes) 0 flags [none] length: 60 10.0.2.2 > 10.0.1.1) ns3::TcpHeader (50000 > 49153 [ACK] Seq=1 Ack=2381 Win=32768 ns3::TcpOptionTS(234;90) ns3::TcpOptionSack(blocks: 1,[2721,4761]))
r 0.234725 /NodeList/0/$ns3::Ipv4L3Protocol/Rx(1) ns3::Ipv4Header (tos 0x2 DSCP Default ECN ECT (0) ttl 64 id 18 protocol 105 offset (bytes) 0 flags [none] length: 392 10.0.1.1 > 10.0.2.2) ns3::TcpHeader (49153 > 50000 [ACK] Seq=5441 Ack=1 Win=32768 ns3::TcpOptionTS(189;143) ns3::TcpOptionEnd(EOL)) Payload (size=340)
t 0.234725 /NodeList/0/$ns3::Ipv4L3Protocol/Tx(2) ns3::Ipv4Header (tos 0x2 DSCP Default ECN ECT (0) ttl 63 id 18 protocol 105 offset (bytes) 0 flags [none] length: 392 10.0.1.1 > 10.0.2.2) ns3::TcpHeader (49153 > 50000 [ACK] Seq=5441 Ack=1 Win=32768 ns3::TcpOptionTS(189;143) ns3::TcpOptionEnd(EOL)) Payload (size=340)
r 0.23504 /NodeList/0/$ns3::Ipv4L3Protocol/Rx(1) ns3::Ipv4Header (tos 0x2 DSCP Default ECN ECT (0) ttl 64 id 19 protocol 105 offset (bytes) 0 flags [none] length: 392 10.0.1.1 > 10.0.2.2) ns3::TcpHeader (49153 > 50000 [ACK] Seq=5781 Ack=1 Win=32768 ns3::TcpOptionTS(189;143) ns3::TcpOptionEnd(EOL)) Payload (size=340)
t 0.23504 /NodeList/0/$ns3::Ipv4L3Protocol/Tx(2) ns3::Ipv4Header (tos 0x2 DSCP Default ECN ECT (0) ttl 63 id 19 protocol 105 offset (bytes) 0 flags [none] length: 392 10.0.1.1 > 10.0.2.2) ns3::TcpHeader (49153 > 50000 [ACK] Seq=5781 Ack=1 Win=32768 ns3::TcpOptionTS(189;143) ns3::TcpOptionEnd(EOL)) Payload (size=340)
r 0.235996 /NodeList/2/$ns3::Ipv4L3Protocol/Rx(1) ns3::Ipv4Header (tos 0x2 DSCP Default ECN ECT (0) ttl 63 id 16 protocol 105 offset (bytes) 0 flags [none] length: 392 10.0.1.1 > 10.0.2.2) ns3::TcpHeader (49153 > 50000 [ACK] Seq=4761 Ack=1 Win=32768 ns3::TcpOptionTS(185;140) ns3::TcpOptionEnd(EOL)) Payload (size=340)
t 0.235996 /NodeList/2/$ns3::Ipv4L3Protocol/Tx(1) ns3::Ipv4Header (tos 0x0 DSCP Default ECN Not-ECT ttl 64 id 11 protocol 105 offset (bytes) 0 flags [none] length: 60 10.0.2.2 > 10.0.1.1) ns3::TcpHeader (50000 > 49153 [ACK] Seq=1 Ack=2381 Win=32768 ns3::TcpOptionTS(235;90) ns3::TcpOptionSack(blocks: 1,[2721,5101]))
r 0.236254 /NodeList/0/$ns3::Ipv4L3Protocol/Rx(2) ns3::Ipv4Header (tos 0x0 DSCP Default ECN Not-ECT ttl 64 id 11 protocol 105 offset (bytes) 0 flags [none] length: 60 10.0.2.2 > 10.0.1.1) ns3::TcpHeader (50000 > 49153 [ACK] Seq=1 Ack=2381 Win=32768 ns3::TcpOptionTS(235;90) ns3::TcpOptionSack(blocks: 1,[2721,5101]))
t 0.236254 /NodeList/0/$ns3::Ipv4L3Protocol/Tx(1) ns3::Ipv4Header (tos 0x0 DSCP Default ECN Not-ECT ttl 63 id 11 protocol 105 offset (bytes) 0 flags [none] length: 60 10.0.2.2 > 10.0.1.1) ns3::TcpHeader (50000 > 49153 [ACK] Seq=1 Ack=2381 Win=32768 ns3::TcpOptionTS(235;90) ns3::TcpOptionSack(blocks: 1,[2721,5101]))
r 0.237562 /NodeList/0/$ns3::Ipv4L3Protocol/Rx(1) ns3::Ipv4Header (tos 0x2 DSCP Default ECN ECT (0) ttl 64 id 20 protocol 105 offset (bytes) 0 flags [none] length: 392 10.0.1.1 > 10.0.2.2) ns3::TcpHeader (49153 > 50000 [ACK] Seq=6121 Ack=1 Win=32768 ns3::TcpOptionTS(192;146) ns3::TcpOptionEnd(EOL)) Payload (size=340)
t 0.237562 /NodeList/0/$ns3::Ipv4L3Protocol/Tx(2) ns3::Ipv4Header (tos 0x2 DSCP Default ECN ECT (0) ttl 63 id 20 protocol 105 offset (bytes) 0 flags [none] length: 392 10.0.1.1 > 10.0.2.2) ns3::TcpHeader (49153 > 50000 [ACK] Seq=6121 Ack=1 Win=32768 ns3::TcpOptionTS(192;146) ns3::TcpOptionEnd(EOL)) Payload (size=340)
r 0.237572 /NodeList/2/$ns3::Ipv4L3Protocol/Rx(1) ns3::Ipv4Header (tos 0x2 DSCP Default ECN ECT (0) ttl 63 id 17 protocol 105 offset (bytes) 0 flags [none] length: 392 10.0.1.1 > 10.0.2.2) ns3::TcpHeader (49153 > 50000 [ACK] Seq=5101 Ack=1 Win=32768 ns3::TcpOptionTS(189;143) ns3::TcpOptionEnd(EOL)) Payload (size=340)
t 0.237572 /NodeList/2/$ns3::Ipv4L3Protocol/Tx(1) ns3::Ipv4Header (tos 0x0 DSCP Default ECN Not-ECT ttl 64 id 12 protocol 105 offset (bytes) 0 flags [none] length: 60 10.0.2.2 > 10.0.1.1) ns3::TcpHeader (50000 > 49153 [ACK] Seq=1 Ack=2381 Win=32768 ns3::TcpOptionTS(237;90) ns3::TcpOptionSack(blocks: 1,[2721,5441]))
r 0.23783 /NodeList/0/$ns3::Ipv4L3Protocol/Rx(2) ns3::Ipv4Header (tos 0x0 DSCP Default ECN Not-ECT ttl 64 id 12 protocol 105 offset (bytes) 0 flags [none] length: 60 10.0.2.2 > 10.0.1.1) ns3::TcpHeader (50000 > 49153 [ACK] Seq=1 Ack=2381 Win=32768 ns3::TcpOptionTS(237;90) ns3::TcpOptionSack(blocks: 1,[2721,5441]))
t 0.23783 /NodeList/0/$ns3::Ipv4L3Protocol/Tx(1) ns3::Ipv4Header (tos 0x0 DSCP Default ECN Not-ECT ttl 63 id 12 protocol 105 offset (bytes) 0 flags [none] length: 60 10.0.2.2 > 10.0.1.1) ns3::TcpHeader (50000 > 49153 [ACK] Seq=1 Ack=2381 Win=32768 ns3::TcpOptionTS(237;90) ns3::TcpOptionSack(blocks: 1,[2721,5441]))
r 0.237877 /NodeList/0/$ns3::Ipv4L3Protocol/Rx(1) ns3::Ipv4Header (tos 0x2 DSCP Default ECN ECT (0) ttl 64 id 21 protocol 105 offset (bytes) 0 flags [none] length: 392 10.0.1.1 > 10.0.2.2) ns3::TcpHeader (49153 > 50000 [ACK] Seq=6461 Ack=1 Win=32768 ns3::TcpOptionTS(192;146) ns3::TcpOptionEnd(EOL)) Payload (size=340)
t 0.237877 /NodeList/0/$ns3::Ipv4L3Protocol/Tx(2) ns3::Ipv4Header (tos 0x2 DSCP Default ECN ECT (0) ttl 63 id 21 protocol 105 offset (bytes) 0 flags [none] length: 392 10.0.1.1 > 10.0.2.2) ns3::TcpHeader (49153 > 50000 [ACK] Seq=6461 Ack=1 Win=32768 ns3::TcpOptionTS(192;146) ns3::TcpOptionEnd(EOL)) Payload (size=340)
r 0.238192 /NodeList/0/$ns3::Ipv4L3Protocol/Rx(1) ns3::Ipv4Header (tos 0x2 DSCP Default ECN ECT (0) ttl 64 id 22 protocol 105 offset (bytes) 0 flags [none] length: 392 10.0.1.1 > 10.0.2.2) ns3::TcpHeader (49153 > 50000 [ACK] Seq=6801 Ack=1 Win=32768 ns3::TcpOptionTS(192;146) ns3::TcpOptionEnd(EOL)) Payload (size=340)
t 0.238192 /NodeList/0/$ns3::Ipv4L3Protocol/Tx(2) ns3::Ipv4Header (tos 0x2 DSCP Default ECN ECT (0) ttl 63 id 22 protocol 105 offset (bytes) 0 flags [none] length: 392 10.0.1.1 > 10.0.2.2) ns3::TcpHeader (49153 > 50000 [ACK] Seq=6801 Ack=1 Win=32768 ns3::TcpOptionTS(192;146) ns3::TcpOptionEnd(EOL)) Payload (size=340)
r 0.239148 /NodeList/2/$ns3::Ipv4L3Protocol/Rx(1) ns3::Ipv4Header (tos 0x2 DSCP Default ECN ECT (0) ttl 63 id 18 protocol 105 offset (bytes) 0 flags [none] length: 392 10.0.1.1 > 10.0.2.2) ns3::TcpHeader (49153 > 50000 [ACK] Seq=5441 Ack=1 Win=32768 ns3::TcpOptionTS(189;143) ns3::TcpOptionEnd(EOL)) Payload (size=340)
t 0.239148 /NodeList/2/$ns3::Ipv4L3Protocol/Tx(1) ns3::Ipv4Header (tos 0x0 DSCP Default ECN Not-ECT ttl 64 id 13 protocol 105 offset (bytes) 0 flags [none] length: 60 10.0.2.2 > 10.0.1.1) ns3::TcpHeader (50000 > 49153 [ACK] Seq=1 Ack=2381 Win=32768 ns3::TcpOptionTS(239;90) ns3::TcpOptionSack(blocks: 1,[2721,5781]))
r 0.239406 /NodeList/0/$ns3::Ipv4L3Protocol/Rx(2) ns3::Ipv4Header (tos 0x0 DSCP Default ECN Not-ECT ttl 64 id 13 protocol 105 offset (bytes) 0 flags [none] length: 60 10.0.2.2 > 10.0.1.1) ns3::TcpHeader (50000 > 49153 [ACK] Seq=1 Ack=2381 Win=32768 ns3::TcpOptionTS(239;90) ns3::TcpOptionSack(blocks: 1,[2721,5781]))
t 0.239406 /NodeList/0/$ns3::Ipv4L3Protocol/Tx(1) ns3::Ipv4Header (tos 0x0 DSCP Default ECN Not-ECT ttl 63 id 13 protocol 105 offset (bytes) 0 flags [none] length: 60 10.0.2.2 > 10.0.1.1) ns3::TcpHeader (50000 > 49153 [ACK] Seq=1 Ack=2381 Win=32768 ns3::TcpOptionTS(239;90) ns3::TcpOptionSack(blocks: 1,[2721,5781]))
r 0.240724 /NodeList/2/$ns3::Ipv4L3Protocol/Rx(1) ns3::Ipv4Header (tos 0x2 DSCP Default ECN ECT (0) ttl 63 id 19 protocol 105 offset (bytes) 0 flags [none] length: 392 10.0.1.1 > 10.0.2.2) ns3::TcpHeader (49153 > 50000 [ACK] Seq=5781 Ack=1 Win=32768 ns3::TcpOptionTS(189;143) ns3::TcpOptionEnd(EOL)) Payload (size=340)
t 0.240724 /NodeList/2/$ns3::Ipv4L3Protocol/Tx(1) ns3::Ipv4Header (tos 0x0 DSCP Default ECN Not-ECT ttl 64 id 14 protocol 105 offset (bytes) 0 flags [none] length: 60 10.0.2.2 > 10.0.1.1) ns3::TcpHeader (50000 > 49153 [ACK] Seq=1 Ack=2381 Win=32768 ns3::TcpOptionTS(240;90) ns3::TcpOptionSack(blocks: 1,[2721,6121]))
r 0.240752 /NodeList/0/$ns3::Ipv4L3Protocol/Rx(1) ns3::Ipv4Header (tos 0x2 DSCP Default ECN ECT (0) ttl 64 id 23 protocol 105 offset (bytes) 0 flags [none] length: 392 10.0.1.1 > 10.0.2.2) ns3::TcpHeader (49153 > 50000 [ACK] Seq=7141 Ack=1 Win=32768 ns3::TcpOptionTS(195;150) ns3::TcpOptionEnd(EOL)) Payload (size=340)
t 0.240752 /NodeList/0/$ns3::Ipv4L3Protocol/Tx(2) ns3::Ipv4Header (tos 0x2 DSCP Default ECN ECT (0) ttl 63 id 23 protocol 105 offset (bytes) 0 flags [none] length: 392 10.0.1.1 > 10.0.2.2) ns3::TcpHeader (49153 > 50000 [ACK] Seq=7141 Ack=1 Win=32768 ns3::TcpOptionTS(195;150) ns3::TcpOptionEnd(EOL)) Payload (size=340)
r 0.240982 /NodeList/0/$ns3::Ipv4L3Protocol/Rx(2) ns3::Ipv4Header (tos 0x0 DSCP Default ECN Not-ECT ttl 64 id 14 protocol 105 offset (bytes) 0 flags [none] length: 60 10.0.2.2 > 10.0.1.1) ns3::TcpHeader (50000 > 49153 [ACK] Seq=1 Ack=2381 Win=32768 ns3::TcpOptionTS(240;90) ns3::TcpOptionSack(blocks: 1,[2721,6121]))
t 0.240982 /NodeList/0/$ns3::Ipv4L3Protocol/Tx(1) ns3::Ipv4Header (tos 0x0 DSCP Default ECN Not-ECT ttl 63 id 14 protocol 105 offset (bytes) 0 flags [none] length: 60 10.0.2.2 > 10.0.1.1) ns3::TcpHeader (50000 > 49153 [ACK] Seq=1 Ack=2381 Win=32768 ns3::TcpOptionTS(240;90) ns3::TcpOptionSack(blocks: 1,[2721,6121]))
r 0.2423 /NodeList/2/$ns3::Ipv4L3Protocol/Rx(1) ns3::Ipv4Header (tos 0x2 DSCP Default ECN ECT (0) ttl 63 id 20 protocol 105 offset (bytes) 0 flags [none] length: 392 10.0.1.1 > 10.0.2.2) ns3::TcpHeader (49153 > 50000 [ACK] Seq=6121 Ack=1 Win=32768 ns3::TcpOptionTS(192;146) ns3::TcpOptionEnd(EOL)) Payload (size=340)
t 0.2423 /NodeList/2/$ns3::Ipv4L3Protocol/Tx(1) ns3::Ipv4Header (tos 0x0 DSCP Default ECN Not-ECT ttl 64 id 15 protocol 105 offset (bytes) 0 flags [none] length: 60 10.0.2.2 > 10.0.1.1) ns3::TcpHeader (50000 > 49153 [ACK] Seq=1 Ack=2381 Win=32768 ns3::TcpOptionTS(242;90) ns3::TcpOptionSack(blocks: 1,[2721,6461]))
r 0.242558 /NodeList/0/$ns3::Ipv4L3Protocol/Rx(2) ns3::Ipv4Header (tos 0x0 DSCP Default ECN Not-ECT ttl 64 id 15 protocol 105 offset (bytes) 0 flags [none] length: 60 10.0.2.2 > 10.0.1.1) ns3::TcpHeader (50000 > 49153 [ACK] Seq=1 Ack=2381 Win=32768 ns3::TcpOptionTS(242;90) ns3::TcpOptionSack(blocks: 1,[2721,6461]))
t 0.242558 /NodeList/0/$ns3::Ipv4L3Protocol/Tx(1) ns3::Ipv4Header (tos 0x0 DSCP Default ECN Not-ECT ttl 63 id 15 protocol 105 offset (bytes) 0 flags [none] length: 60 10.0.2.2 > 10.0.1.1) ns3::TcpHeader (50000 > 49153 [ACK] Seq=1 Ack=2381 Win=32768 ns3::TcpOptionTS(242;90) ns3::TcpOptionSack(blocks: 1,[2721,6461]))
r 0.243876 /NodeList/2/$ns3::Ipv4L3Protocol/Rx(1) ns3::Ipv4Header (tos 0x2 DSCP Default ECN ECT (0) ttl 63 id 21 protocol 105 offset (bytes) 0 flags [none] length: 392 10.0.1.1 > 10.0.2.2) ns3::TcpHeader (49153 > 50000 [ACK] Seq=6461 Ack=1 Win=32768 ns3::TcpOptionTS(192;146) ns3::TcpOptionEnd(EOL)) Payload (size=340)
t 0.243876 /NodeList/2/$ns3::Ipv4L3Protocol/Tx(1) ns3::Ipv4Header (tos 0x0 DSCP Default ECN Not-ECT ttl 64 id 16 protocol 105 offset (bytes) 0 flags [none] length: 60 10.0.2.2 > 10.0.1.1) ns3::TcpHeader (50000 > 49153 [ACK] Seq=1 Ack=2381 Win=32768 ns3::TcpOptionTS(243;90) ns3::TcpOptionSack(blocks: 1,[2721,6801]))
r 0.244134 /NodeList/0/$ns3::Ipv4L3Protocol/Rx(2) ns3::Ipv4Header (tos 0x0 DSCP Default ECN Not-ECT ttl 64 id 16 protocol 105 offset (bytes) 0 flags [none] length: 60 10.0.2.2 > 10.0.1.1) ns3::TcpHeader (50000 > 49153 [ACK] Seq=1 Ack=2381 Win=32768 ns3::TcpOptionTS(243;90) ns3::TcpOptionSack(blocks: 1,[2721,6801]))
t 0.244134 /NodeList/0/$ns3::Ipv4L3Protocol/Tx(1) ns3::Ipv4Header (tos 0x0 DSCP Default ECN Not-ECT ttl 63 id 16 protocol 105 offset (bytes) 0 flags [none] length: 60 10.0.2.2 > 10.0.1.1) ns3::TcpHeader (50000 > 49153 [ACK] Seq=1 Ack=2381 Win=32768 ns3::TcpOptionTS(243;90) ns3::TcpOptionSack(blocks: 1,[2721,6801]))
r 0.245452 /NodeList/2/$ns3::Ipv4L3Protocol/Rx(1) ns3::Ipv4Header (tos 0x2 DSCP Default ECN ECT (0) ttl 63 id 22 protocol 105 offset (bytes) 0 flags [none] length: 392 10.0.1.1 > 10.0.2.2) ns3::TcpHeader (49153 > 50000 [ACK] Seq=6801 Ack=1 Win=32768 ns3::TcpOptionTS(192;146) ns3::TcpOptionEnd(EOL)) Payload (size=340)
t 0.245452 /NodeList/2/$ns3::Ipv4L3Protocol/Tx(1) ns3::Ipv4Header (tos 0x0 DSCP Default ECN Not-ECT ttl 64 id 17 protocol 105 offset (bytes) 0 flags [none] length: 60 10.0.2.2 > 10.0.1.1) ns3::TcpHeader (50000 > 49153 [ACK] Seq=1 Ack=2381 Win=32768 ns3::TcpOptionTS(245;90) ns3::TcpOptionSack(blocks: 1,[2721,7141]))
r 0.24571 /NodeList/0/$ns3::Ipv4L3Protocol/Rx(2) ns3::Ipv4Header (tos 0x0 DSCP Default ECN Not-ECT ttl 64 id 17 protocol 105 offset (bytes) 0 flags [none] length: 60 10.0.2.2 > 10.0.1.1) ns3::TcpHeader (50000 > 49153 [ACK] Seq=1 Ack=2381 Win=32768 ns3::TcpOptionTS(245;90) ns3::TcpOptionSack(blocks: 1,[2721,7141]))
t 0.24571 /NodeList/0/$ns3::Ipv4L3Protocol/Tx(1) ns3::Ipv4Header (tos 0x0 DSCP Default ECN Not-ECT ttl 63 id 17 protocol 105 offset (bytes) 0 flags [none] length: 60 10.0.2.2 > 10.0.1.1) ns3::TcpHeader (50000 > 49153 [ACK] Seq=1 Ack=2381 Win=32768 ns3::TcpOptionTS(245;90) ns3::TcpOptionSack(blocks: 1,[2721,7141]))
r 0.247028 /NodeList/2/$ns3::Ipv4L3Protocol/Rx(1) ns3::Ipv4Header (tos 0x2 DSCP Default ECN ECT (0) ttl 63 id 23 protocol 105 offset (bytes) 0 flags [none] length: 392 10.0.1.1 > 10.0.2.2) ns3::TcpHeader (49153 > 50000 [ACK] Seq=7141 Ack=1 Win=32768 ns3::TcpOptionTS(195;150) ns3::TcpOptionEnd(EOL)) Payload (size=340)
t 0.247028 /NodeList/2/$ns3::Ipv4L3Protocol/Tx(1) ns3::Ipv4Header (tos 0x0 DSCP Default ECN Not-ECT ttl 64 id 18 protocol 105 offset (bytes) 0 flags [none] length: 60 10.0.2.2 > 10.0.1.1) ns3::TcpHeader (50000 > 49153 [ACK] Seq=1 Ack=2381 Win=32768 ns3::TcpOptionTS(247;90) ns3::TcpOptionSack(blocks: 1,[2721,7481]))
r 0.247286 /NodeList/0/$ns3::Ipv4L3Protocol/Rx(2) ns3::Ipv4Header (tos 0x0 DSCP Default ECN Not-ECT ttl 64 id 18 protocol 105 offset (bytes) 0 flags [none] length: 60 10.0.2.2 > 10.0.1.1) ns3::TcpHeader (50000 > 49153 [ACK] Seq=1 Ack=2381 Win=32768 ns3::TcpOptionTS(247;90) ns3::TcpOptionSack(blocks: 1,[2721,7481]))
t 0.247286 /NodeList/0/$ns3::Ipv4L3Protocol/Tx(1) ns3::Ipv4Header (tos 0x0 DSCP Default ECN Not-ECT ttl 63 id 18 protocol 105 offset (bytes) 0 flags [none] length: 60 10.0.2.2 > 10.0.1.1) ns3::TcpHeader (50000 > 49153 [ACK] Seq=1 Ack=2381 Win=32768 ns3::TcpOptionTS(247;90) ns3::TcpOptionSack(blocks: 1,[2721,7481]))
r 0.274999 /NodeList/1/$ns3::Ipv4L3Protocol/Rx(1) ns3::Ipv4Header (tos 0x0 DSCP Default ECN Not-ECT ttl 63 id 7 protocol 105 offset (bytes) 0 flags [none] length: 60 10.0.2.2 > 10.0.1.1) ns3::TcpHeader (50000 > 49153 [ACK] Seq=1 Ack=2381 Win=32768 ns3::TcpOptionTS(229;90) ns3::TcpOptionSack(blocks: 1,[2721,3741]))
t 0.274999 /NodeList/1/$ns3::Ipv4L3Protocol/Tx(1) ns3::Ipv4Header (tos 0x2 DSCP Default ECN ECT (0) ttl 64 id 24 protocol 105 offset (bytes) 0 flags [none] length: 392 10.0.1.1 > 10.0.2.2) ns3::TcpHeader (49153 > 50000 [ACK] Seq=2381 Ack=1 Win=32768 ns3::TcpOptionTS(274;229) ns3::TcpOptionEnd(EOL)) Payload (size=340)
t 0.274999 /NodeList/1/$ns3::Ipv4L3Protocol/Tx(1) ns3::Ipv4Header (tos 0x2 DSCP Default ECN ECT (0) ttl 64 id 25 protocol 105 offset (bytes) 0 flags [none] length: 392 10.0.1.1 > 10.0.2.2) ns3::TcpHeader (49153 > 50000 [ACK] Seq=7481 Ack=1 Win=32768 ns3::TcpOptionTS(274;229) ns3::TcpOptionEnd(EOL)) Payload (size=340)
t 0.274999 /NodeList/1/$ns3::Ipv4L3Protocol/Tx(1) ns3::Ipv4Header (tos 0x2 DSCP Default ECN ECT (0) ttl 64 id 26 protocol 105 offset (bytes) 0 flags [none] length: 392 10.0.1.1 > 10.0.2.2) ns3::TcpHeader (49153 > 50000 [ACK] Seq=7821 Ack=1 Win=32768 ns3::TcpOptionTS(274;229) ns3::TcpOptionEnd(EOL)) Payload (size=340)
r 0.276575 /NodeList/1/$ns3::Ipv4L3Protocol/Rx(1) ns3::Ipv4Header (tos 0x0 DSCP Default ECN Not-ECT ttl 63 id 8 protocol 105 offset (bytes) 0 flags [none] length: 60 10.0.2.2 > 10.0.1.1) ns3::TcpHeader (50000 > 49153 [ACK] Seq=1 Ack=2381 Win=32768 ns3::TcpOptionTS(231;90) ns3::TcpOptionSack(blocks: 1,[2721,4081]))
